OBSZAR;TEZA_MINIMALNA;REKORDY_BAZOWE;STATUS;UWAGA_METODOLOGICZNA
czlowiek;Istnieją źródła osobiste i pośmiertne odnoszące się do Jana;T777_006;aktywny;na razie pakiet szczątkowy
oficer;Jan występuje w materiale [P] jako osoba osadzona w strukturze wojskowej;T777_002,T777_003,T777_005;aktywny;wymaga dalszego doszczelnienia osi wojskowej
dyrektor;Jan występuje w materiale [P] jako dyrektor zakładu i uczestnik obiegu instytucjonalnego;T777_008,T777_009,T777_010,T777_011,T777_012,T777_013,T777_017,T777_018;aktywny;pakiet zawodowy [P]
publiczny;Jan występuje w materiale [P] w obiegu publicznym i prasowym;T777_024;aktywny;nie rozstrzyga zakresu realnej sprawczości
operacyjny_jako_przedmiot_zrodla;Istnieją nośniki SB odnoszące się do Jana jako przedmiotu materiału operacyjnego;T777_025,T777_026;aktywny;treść wymaga krytyki źródła, nie jest samowystarczalnym rozstrzygnięciem
po_smierci;Istnieje urzędowy dokument pośmiertny z datą 12.05.1982;T777_006;aktywny;wymaga rozbudowy o podstawę wpisu USC i dokumentację medyczną
